{"allow_trusted_local":false,"artifact_root":"objects","config_revision":0,"containment_backend":"linux_namespace","database":"journal.sqlite","default_limits":{"artifact_bytes":16777216,"concurrent_reads":4,"concurrent_writes_per_resource":"one","cpu_ms":1800000,"currency":"EUR","currency_micro_units":0,"elapsed_ms":1800000,"model_requests":12,"model_tokens_total":20000,"scratch_bytes":1073741824,"tool_attempts":64},"principal_id":"local-user","provider_profile_ref":null,"registry_digest":"3ca4cc294b3af85e694ddcdeadc656f9d832bd4f4eee37e99aaf3aa41ea70a60","schema":"gabriel.workspace-config/1","schema_version":1,"workspace_id":"ws-539f6405500a"}
